{
  "run_id": "claude-cli-1-20250114-120000-abc12",
  "agent": "claude-cli-1",
  "timestamp": "2025-01-14T12:00:00Z",
  "duration_seconds": 1800,
  "summary": "Implemented user authentication endpoints with JWT token validation and refresh logic.",
  "decisions": [
    {
      "decision": "Use JWT for stateless authentication",
      "rationale": "Works well with microservices, no session storage needed",
      "alternatives_considered": ["Session-based auth", "OAuth2 only"],
      "reversible": true
    },
    {
      "decision": "Store refresh tokens in database",
      "rationale": "Allows token revocation and better security control",
      "alternatives_considered": ["Redis cache", "Cookie-only"],
      "reversible": true
    }
  ],
  "open_questions": [
    {
      "question": "Should we implement rate limiting on auth endpoints?",
      "context": "Currently no rate limiting, could be vulnerable to brute force",
      "priority": "high",
      "blocking": false
    }
  ],
  "risks": [
    {
      "risk": "JWT secret rotation not yet implemented",
      "severity": "medium",
      "mitigation": "Add key rotation mechanism in next sprint"
    }
  ],
  "changes": [
    {
      "path": "src/auth/jwt.ts",
      "action": "created",
      "description": "JWT token generation and validation"
    },
    {
      "path": "src/auth/middleware.ts",
      "action": "created",
      "description": "Auth middleware for protected routes"
    },
    {
      "path": "src/api/auth.ts",
      "action": "modified",
      "description": "Added login/logout/refresh endpoints"
    }
  ],
  "next_actions": [
    {
      "action": "Add rate limiting to auth endpoints",
      "assignee": "codex-cli-1",
      "priority": "high"
    },
    {
      "action": "Write integration tests for auth flow",
      "assignee": "claude-cli-2",
      "priority": "normal"
    }
  ],
  "refs": [
    {
      "type": "commit",
      "value": "abc123def456",
      "description": "feat: add JWT authentication"
    },
    {
      "type": "doc",
      "value": "kb/internal/auth/jwt-flow.md",
      "description": "Auth flow documentation"
    }
  ],
  "learnings": [
    {
      "learning": "jsonwebtoken library requires explicit algorithm specification for security",
      "category": "technical"
    },
    {
      "learning": "Refresh token rotation prevents token theft attacks",
      "category": "architecture"
    }
  ],
  "redactions_done": true,
  "exit_status": "success"
}
